{
  "id": "qa-001",
  "qaAgent": "qa-inspector",
  "findingId": "finding-001",
  "status": "passed",
  "rationale": "The finding includes a clear architecture claim, traceable evidence, and an actionable recommendation.",
  "checks": [
    {
      "name": "evidence-present",
      "status": "passed",
      "notes": "File path and line range are present."
    }
  ],
  "requiresFollowUp": false,
  "createdAt": "2026-06-20T02:00:00.000Z"
}
